flower.id,flower.ts,flower.title,flower.price,flower.description
73,"2018-01-10 15:00:12","The Congratulations Balloon Bunch",39.99,"When you want your gift to make a big impression, give them this fun Balloon Bouquet. The bouquet arrives with 2 mylar balloons surrounded by 6 latex balloons and tied together with a ribbon. The congratulations mylar balloon designs will vary."
74,"2018-01-10 15:00:27","Isle of White",46.99,"Breathtaking! Blooms of bright white and cream are rich with texture and innocent beauty. Presented in a versatile bubble vase she'll use later for roses, tulips, potpourri, and candlelit centerpieces, this is a fabulously fragrant choice for a bride-to-be, your beloved mom, or an old friend. White roses, white asiatic lilies, and white stock are delivered in a fun bubble vase. Approximately 14"" W x 11 1/2""."
75,"2018-01-10 15:00:38","Classic Stargazer Bouquet",54.99,"Which bouquet is more classic than red roses and stargazer liles? Send your loved one this beautiful bouquet with red roses, stargazer lilies, white larkspur, and pink filler, topped off with a red chiffon bow."
76,"2018-01-10 15:00:43","Glorious Day",66.99,"A stunning arrangement of pink and yellow roses delicately arranged in a regal couture vase that can be reused for years to come! Approx. 15'h x 13""w."
77,"2018-01-10 15:01:03","Stargazer Garden",69.99,"Our freshest collection of 'Stargazer' lilies, bells of Ireland, irises and more. Simply heavenly!"
78,"2018-01-10 15:01:11","Park Avenue Centerpiece",99.99,"For an elegant centerpiece that is equal parts romance and resplendence, this is a wonderful arrangement. With Park Avenue appeal and uptown excitement, a brilliant Mercury Glass Bowl full of dazzling roses, hydrangea and more is sure to be the toast of the town."
79,"2018-01-10 15:01:17","Daisy Craze",29.99,"The perfect bouquet to brighten someon'es day! White and yellow dasies accented with buplerum, greens, and a lovely yellow bow."
80,"2018-01-10 15:01:23","Color Me Yours Bouquet",29.99,"Send this sweet little arrangement to express your sentiments. This is a one-sided arrangement in a classic ginger jar of alstroemeria, carnations, daisies, mini carnations, buplerum, greens and a yellow bow. Approx. 12'h x 11'w."
81,"2018-01-10 15:01:36","A Designer Choice Bouquet",29.99,"Many times it's hard to decide what to send, because we do offer a lot of choices. A Designers Choice Bouquet allows our florist to select the best in season flowers and foliage's for your order, giving you the best value possible for your dollar. Let our florist go to work for you! We'll pick the freshest stems in stock, put them together beautifully for any occasion. Upgrade bouquet options: We'll add more flowers/green that compliment the arrangement, making a larger, fuller, more colorful bouquet."
82,"2018-01-10 15:01:44","Lavender Delight Bouquet",44.99,"Lavender is the color which symbolizes that something is special or unique. This bouquet is the perfect way to express your well wishes. It is an all-around bouquet with 5 lavender carnations, 3 stems of lavender daisies, 3 stems of alstoemeria, & 3 large gerberas. Deluxe: 5 carnations, 4 daisies, 4 alstoemeria, 3 large gerberas Premium: 6 carnations, 4 daisies, 4 alstroemeria, 3 large gerbearas, & 2 lavender roses"
83,"2018-01-10 15:01:47","Stargazer Garden",69.99,"Our freshest collection of 'Stargazer' lilies, bells of Ireland, irises and more. Simply heavenly!"
84,"2018-01-10 15:01:49","Sunny Skies Bouquet",29.99,"Imagine a warm, sunny day intense with color. We've gathered those colors together - deep lavender daisy pompons, sunny yellow daisy pompons and bright white daisy pompons - into a round white-wash basket trimmed with a light green bow. Perfect to celebrate any occasion. (Vase/Basket style may vary)"
85,"2018-01-10 15:01:53","Make a Wish",29.99,"All their wishes will come true when they receive this dainty, bright and sunny flower arrangement a summery mix of yellow daisies, purple asters, hot pink and orange carnations and more, adorned with a cheerful green bow. Send one today, and make someone's day! Standard: One-sided bouquet in a 5"" ginger jar vase, approx.: 10 1/2"" X 12"", Deluxe: One-sided bouquet in a 6"" ginger jar vase, approx.: 12"" X 13""."
86,"2018-01-10 15:01:57","Color Me Yours Bouquet",29.99,"Send this sweet little arrangement to express your sentiments. This is a one-sided arrangement in a classic ginger jar of alstroemeria, carnations, daisies, mini carnations, buplerum, greens and a yellow bow. Approx. 12'h x 11'w."
87,"2018-01-10 15:02:02","Daisy Craze",29.99,"The perfect bouquet to brighten someon'es day! White and yellow dasies accented with buplerum, greens, and a lovely yellow bow."
88,"2018-01-10 15:02:14","A Designer Choice Bouquet",29.99,"Many times it's hard to decide what to send, because we do offer a lot of choices. A Designers Choice Bouquet allows our florist to select the best in season flowers and foliage's for your order, giving you the best value possible for your dollar. Let our florist go to work for you! We'll pick the freshest stems in stock, put them together beautifully for any occasion. Upgrade bouquet options: We'll add more flowers/green that compliment the arrangement, making a larger, fuller, more colorful bouquet."
89,"2018-01-10 15:02:20",Spathiphyllum,34.99,"The spathiphyllum plant is enjoyed by everyone with its glossy, graceful leaves and shapely white flowers. This long-lasting gift is a wonderful way to send your sympathy, or to brighten up anyone's day. Also makes a great corporate gift! Commonly known as the Spath or Peace Lily, this potted plant is delivered in a 6"" diameter basket. We will enhance this gift with a colorful bow. Approximately 18"" W x 28"" H."
90,"2018-01-10 15:02:22","Teleflora's How Sweet It Is",36.99,"Seeking out a fine bouquet that's darling and delightful? This charming mix of fresh blooms in ripe, fruity shades of raspberry, peach and cherry is a tempting pick-me-up for any day of the week. Send one to a favorite friend to brighten up their day."
91,"2018-01-10 15:02:28","Smile for Me",37.99,"Color their week happy with this blazing array of hot pink roses, orange spray roses, purple carnations and more in a sparkling glass bubble bowl. A sweet gift for a birthday, anniversary or any loving occasion. They'll be thrilled. This exciting bouquet includes hot pink roses, orange spray roses, green button spray chrysanthemums, purple carnations and bupleurum. Delivered in a glass bubble bowl. Approximately 12 3/4"" W x 11"" H Orientation:All-Around"
92,"2018-01-10 15:02:32","Sunny Cyclamen",39.99,"Treasured worldwide for their elegant, upswept petals and jewel green leaves, cyclamen are beautiful perennial plants that thrive indoors and out. This pretty pink potted plant is presented in a classic, cream-colored pedestal planter for enjoyment as an indoor plant or out on the porch or patio. A light pink, 6-inch potted cyclamen plant is presented in a 6"" melamine pot cover in assorted styles (not in ceramic container as shown.) Approximately 14"" W x 17"" H."
93,"2018-01-10 15:02:40","Teleflora's Polka Dots and Posies",39.99,"For a special treat that can't be beat, this delightfully cheery bouquet of white daisies and pink roses presented in a delicately tinted pink glass cube vase, accented with a matching pink polka-dot ribbon is like a gift of pure joy!"
94,"2018-01-10 15:02:45","Uplifting Moments",44.99,"Lift up someone's spirits with this lovely basket arrangement of yellow gerbera daisies, yellow spray roses, green hypericum berry and greens. This is an all-around arrangement. Approx. 10""H x 10""W"
95,"2018-01-10 15:02:54","The Florist Designed Blooming and Green Plants in a Basket",49.99,"Can't decide which plant to send? Let us design something special with our most beautiful blooming and green plants in a basket. The combination will make a lovely presentation - appropriate for any occasion! (Basket style may vary)"
96,"2018-01-10 15:02:58","End of the Rainbow",52.99,"Encourage a young woman or beloved friend to follow her rainbow with this bright, vivacious bouquet. Featuring hot pink gerbera daisies and orange roses, the youthful arrangement pops with summery fun! Hot pink gerbera, bi-color orange roses, orange spray roses, green button mums and bupleurum are presented in a clear glass vase. Approximately 8"" W x 12"" H."
97,"2018-01-10 15:03:01","Fresh Picked",54.99,"Send this bountiful basket for any occasion that's as fun to look at as it is to eat! This basket of fresh fruit is accented with a potted orange kalanchoe plant and autumnal elements including oak leaves, wheat and red taffeta ribbon. A natural oval basket presents an assortment of fresh fruit including 2 pears, 2 red apples, 2 green apples, 2 oranges and a bunch of red grapes. Approximately 19"" W x 15 1/2"" H."
98,"2018-01-10 15:03:05","A Splendid Day",59.99,"It is a splendid day when these flowers arrive at the door. Send this lovely bubble bowl arrangement with lavender roses, purple motsumoto asters, green buttons mums and green hypericum berries."
99,"2018-01-10 15:03:15","Stargazer Garden",69.99,"Our freshest collection of 'Stargazer' lilies, bells of Ireland, irises and more. Simply heavenly!"
100,"2018-01-10 15:03:18","A Designer Choice Bouquet",29.99,"Many times it's hard to decide what to send, because we do offer a lot of choices. A Designers Choice Bouquet allows our florist to select the best in season flowers and foliage's for your order, giving you the best value possible for your dollar. Let our florist go to work for you! We'll pick the freshest stems in stock, put them together beautifully for any occasion. Upgrade bouquet options: We'll add more flowers/green that compliment the arrangement, making a larger, fuller, more colorful bouquet."
